<?xml version="1.0" encoding="UTF-8"?>
<response xmlns:xsi="http://www.w3.org/2001/XMLSchema-instance"
	xsi:noNamespaceSchemaLocation="ResponseTypes.xsd">

	<callback>
		<bean>
	org.egov.bean.eventCallbackBean
	</bean>
	</callback>
	<email>
		<to>ro@coc.gov.in</to>
		<cc>${cc_address}</cc>
		<body>
		    Dear ${to_name},
		    The following receipt has been cancelled -
		    lorem ipsum ${receipt_no} dolor
		    lorem dolor
 		</body>
	</email>
	<email>
		<to>ro@coc.gov.in</to>
		<cc>${cc_address}</cc>
		<body>
            Dear ${to_name},
            The following receipt has been cancelled -
            lorem ipsum ${receipt_no} dolor
            lorem dolor
        </body>
	</email>
	<sms>
		<phonenumber>11111</phonenumber>
		<message> lorem ipsum ${receipt_no} dolor </message>
	</sms>
	<sms>
		<phonenumber>11111</phonenumber>
		<message> lorem ipsum ${receipt_no} dolor </message>
	</sms>
</response>
